{
  "$schema": "https://json-schema.org/draft/2020-12/schema",
  "$id": "https://blazn.dev/contracts/development-project.schema.json",
  "title": "Blazn POC Development Project",
  "type": "object",
  "additionalProperties": false,
  "required": ["schemaVersion", "projectId", "repository", "template", "publicationTarget", "platforms", "build", "dependencyLocks", "tests", "policy"],
  "properties": {
    "schemaVersion": {"const": "blazn.dev/project/v1alpha1"},
    "projectId": {"type": "string", "format": "uuid"},
    "repository": {
      "type": "object", "additionalProperties": false, "required": ["url"],
      "properties": {"url": {"type": "string", "format": "uri", "pattern": "^https://[A-Za-z0-9.-]+(?::[0-9]+)?/[A-Za-z0-9._-]+/[A-Za-z0-9._-]+(?:\\.git)?$"}}
    },
    "template": {
      "type": "object", "additionalProperties": false, "required": ["versionId", "digest"],
      "properties": {"versionId": {"type": "string", "format": "uuid"}, "digest": {"$ref": "#/$defs/digest"}}
    },
    "publicationTarget": {
      "type": "object", "additionalProperties": false, "required": ["templateId"],
      "properties": {"templateId": {"type": "string", "format": "uuid"}}
    },
    "platforms": {
      "type": "array", "minItems": 2, "maxItems": 2, "uniqueItems": true,
      "items": {"enum": ["linux/amd64", "linux/arm64"]},
      "allOf": [{"contains": {"const": "linux/amd64"}}, {"contains": {"const": "linux/arm64"}}]
    },
    "build": {
      "type": "object", "additionalProperties": false, "required": ["context", "dockerfile", "registryRepository"],
      "properties": {
        "context": {"$ref": "#/$defs/repositoryPath"},
        "dockerfile": {"$ref": "#/$defs/repositoryPath"},
        "registryRepository": {"$ref": "#/$defs/registryRepository"}
      }
    },
    "dependencyLocks": {
      "type": "object", "minProperties": 1, "maxProperties": 32,
      "propertyNames": {"$ref": "#/$defs/repositoryPath"},
      "additionalProperties": {"$ref": "#/$defs/digest"}
    },
    "tests": {
      "type": "object", "minProperties": 1, "maxProperties": 32,
      "propertyNames": {"$ref": "#/$defs/policyName"},
      "additionalProperties": {
        "type": "object", "additionalProperties": false, "required": ["argv", "timeoutSeconds"],
        "properties": {
          "argv": {
            "type": "array", "minItems": 1, "maxItems": 64,
            "prefixItems": [{"type": "string", "not": {"pattern": "(?:^|/)(?:sh|bash|dash|zsh|fish|ksh|csh|tcsh|env|cmd(?:\\.exe)?|powershell(?:\\.exe)?|pwsh)$"}}],
            "items": {"type": "string", "minLength": 1, "maxLength": 1024}
          },
          "timeoutSeconds": {"type": "integer", "minimum": 1, "maximum": 1800}
        }
      }
    },
    "policy": {
      "type": "object", "additionalProperties": false,
      "required": ["builderProfile", "networkProfile", "resourceProfile", "publicationPolicy"],
      "properties": {
        "builderProfile": {"$ref": "#/$defs/policyName"},
        "networkProfile": {"$ref": "#/$defs/policyName"},
        "resourceProfile": {"$ref": "#/$defs/policyName"},
        "publicationPolicy": {"$ref": "#/$defs/policyName"}
      }
    }
  },
  "$defs": {
    "digest": {"type": "string", "pattern": "^sha256:[0-9a-f]{64}$"},
    "repositoryPath": {"type": "string", "minLength": 1, "maxLength": 512, "pattern": "^(?!/)(?!.*(?:^|/)\\.\\.(?:/|$))(?!.*[\\u0000-\\u001f]).+$"},
    "policyName": {"type": "string", "pattern": "^[a-z][a-z0-9-]{0,62}$"},
    "registryRepository": {"type": "string", "pattern": "^[a-z0-9](?:[a-z0-9.-]*[a-z0-9])?(?::[0-9]{1,5})?/[a-z0-9]+(?:[._-][a-z0-9]+)*(?:/[a-z0-9]+(?:[._-][a-z0-9]+)*)*$", "maxLength": 512}
  },
  "x-blazn-test-command-invariants": ["argv[0] is not a shell or env launcher", "argv contains no credential assignment, bearer token, URL userinfo, or secret-bearing flag", "the named POC test definition is committed inside projectManifestDigest"]
}
